,Class,Data,char_length,word_count
2965,1,quá đẹp luôn. ở đâu bán vậy?,28,7
2966,1,quá ổn so với tầm giá!,22,6
2967,1,"tin vui cho người tiêu dùng có thu nhập trung bình là đây , dung lượng pin là điều tôi thích nhất ở sản phẩm này , phải mua ngay thôi ...",137,32
2968,1,đẹp đó! về vn sẽ làm 1 em,25,8
2969,1,dùng con zenfone 5 được 2 năm thấy khá ổn các bác ạ. ấn tượng tốt với asus,72,18
2970,1,thì apple kn chả đi sau hả bạn! đến con 6plus ram còn 1gb trong khi các dòng khác đã 3gb từ thưở nào rồi. tuy nhiên cái gì của apple nó cũng chất lượng hết. một phần do ios là hệ điều hành quá tuyệt vời,202,47
2971,1,ồh một thay đổi lớn làm thay đổi thế giới đây! đúng là chúng ta không sống nỗi vì thiếu nó được...,98,22
2972,1,còn này lại cháy hàng cho mà xem.,33,8
2973,1,"mình cũng như bạn nhưng không thấy hối tiếc gì vì cũng đã 5 năm cho một sản phẩm đến giờ vẫn không chịu hư là quá tốt,đang gom xiền lấy em 6s plus đây",150,35
2974,1,apple quá đẳng cấp! con gà mái ip7 sẽ tiếp tục đẻ trứng vàng cho apple.,71,16
2975,1,màu này đẹp nè!,15,4
2976,1,wow cái màu mới đẹp quá !,25,7
2977,1,màu xanh sẽ tạo ra sự khác biệt cho dòng điện thoại ip với các hãng khác. nói chung là đẹp xuất sắc,97,23
2978,1,đẹp kinh khủng luôn bà con ơi cười,32,8
2979,1,không thể cưỡng lại được. quá...đẹp. 6 đang chờ lên 7.,54,11
2980,1,"quá đẹp cho ip7, lại hot nữa đây.",33,8
2981,1,đẹp quá,7,2
2982,1,"bữa trước thấy xanh lam nhỉn bẩn bựa, bữa nay đổi màu này nhìn đẹp a",68,16
2983,1,"màu xanh tôi yêu, quá tuyệt ra màu này apple không có đối thủ.",62,14
2984,1,đẹp quá nhìn cứ như mấy dòng của htc ý cười,41,11
2985,1,màu đẹp quá. đang có 6s lại phải tốn tiền để đổi em và mang em về rồi.,70,18
2986,1,"màu xanh đậm đẹp quá, nhìn rất nam tính, khỏe khoắn và chất.",60,13
2987,1,"màu của mình đây rồi, chờ mãi từ 4s giờ mới có máy ưng ý. cảm ơn bác tim cook sớm biết thay đổi màu sắc, cứ hồng mãi thì nản thật.",130,32
2988,1,"xin chia buồn với ai đã mua ip 4,5,6.... tớ chuẩn bị mua ip 7 đây. con này tài khoản đẹp nhất từ trước tớn nay và bây giờ mới có hứng với ip.",134,33
2989,1,"đẹp quá, màu này rất nam tính, chứ chẳng như màu vàng hồng chỉ hợp với con gái thôi.",84,19
2990,1,nhìn là khoái,13,3
2991,1,dung la rat dep nhung day chi la phong doan,43,10
2992,1,leveu nghe nhac da that ba con ak,33,8
2993,1,mình cũng chỉ mong một thiết bị đeo tay đến vậy thôi.....,57,12
2994,1,quá đẹp.,8,2
2995,1,con này mà cầm lên chụp hình không cần biết chất lượng thế nào đã khen đẹp rồi,74,18
2996,1,em vẫn đẹp dưới con mắt của tôi.,32,8
2997,1,siêu phẩm thế kỷ là đây !,25,7
2998,1,đẹp lắm. đang xài 4s. chờ ip7 ra mình lên đời iphone se,55,13
2999,1,"dùng iphone vẫn thích nhất, bền bỉ...",37,7
3000,1,"rất đẹp, đang xài 4s",20,5
3001,1,sony vẫn là số 1.,17,5
3002,1,tv bự coi đá banh mới sướng. quất em samsung 48ju6000 quả không hối hận.,72,15
3003,1,"được cái samsung màn hình to vẫn net căng nên xem nó đã, cảm giác chân thật, sống động nữa.",91,20
3004,1,"cỡ màn hình bự bự thì chọn mấy con samsung đó, coi nó nét căng, không bị giật giật hay nhẽo hình như một số loại khác.",115,27
3005,1,"trải nghiệm trực tiếp rút ra được một kinh nghiệm đó là chất lượng hỉnh ảnh, âm thanh của samsung vẫn là đỉnh nhất so với giá tiền.",131,28
3006,1,"sản phẩm tốt, giá hợp lý không nên chê .",40,10
3007,1,"mình thì đang dùng con samsung new seríes 9 bản 2012 mua cũ 9tr3 xài được hơn 1 năm, nhìn đi nhìn lại chả con nào ưng ý bằng con này, cực đẹp, pin trâu, cấu hình khá cười",166,39
3008,1,quá tuyệt vời. không biết phiên bản 2 3 sẽ như thế nào nữa,58,14
3009,1,tuyệt đấy. sam sung biến ý tưởng thành sản phẩm cực nhanh,57,12
3010,1,"thiết bị đạt chuẩn chống nước ip68 , cái này ngon",49,11
3011,1,"vừa thoát vụ panama, phải sắm con này ngay mới được. 14k bằng ổ bánh mỳ thỉ phải, quá rẻ..................",106,20
3012,1,nhin thiet ke đẹp quá.,22,5
3013,1,bỏ qua những thứ bên lề thì em nó rất đẹp! rất phong cách!,58,14
3014,1,tuyet vời. có thể mua ỡ đâu ạ.,30,8
3015,1,càng lúc càng thích mediatek rồi.,33,6
3016,1,"tui bị mê thiết kế của dòng suhd quá chài, mỏng mịn, đẹp từ mọi góc nhìn. lại còn thiết kế tràn cạnh nữa, cảm giác không gian, hình ảnh nó bất tận, không bị giới hạn luôn nè.",171,39
3017,1,"100 triệu có khác nhìn cao cấp, hoành tráng phết, không có gì phải phàn nàn luôn. quá tuyệt!!!",91,19
3018,1,bồ kết nhất chất lượng hình ảnh của tv samsung đó.,50,11
3019,1,"nhìn thấy lung linh, tìm hiểu thấy ngon đó mà tầm cỡ em không kham được. nhà em chỉ cần tậu con suhd ks7000 là đủ dùng rồi",119,28
3020,1,"sao mình thấy chất lượng bảo hành bên này tốt mà, tới là được chào đón rất tốt. mà bảo hành cũng rất nhanh đâu như bác nói đâu nhỉ.",131,30
3021,1,"đợt ra mắt này thấy mẫu mã zenfone thay đổi nhiều máy đẹp, giá tầm trung amp tính năng khá.",94,20
3022,1,nhìn quá chất rồi đẹp mỏng cao cấp không dùng nhựa nữa thật quá đẹp cần 1 số tiền để rước em nó về với mình buồn,110,27
3023,1,"chế độ bảo hành của asus cực tốt, mình đến nhiều rồi nên biết. vote cho asus",76,17
3024,1,muốn có 1 con quá,17,5
3025,1,"xiaomi mi4 giá khoảng 3tr cấu hình camera sau 13mp, camera trước 8mp, cpu 2.5 ghz, màn hình full hd, ram 3gb, bộ nhớ 16gb...theo tôi thì đây là máy giá rẽ mà cấu hình cao nhất trong các loại điện thoại phổ thông hiện nay.",213,45
3026,1,tùy sơ thích và nhu cầu sử dụng mỗi người nhưng đang dùng htc desirs 616 dual sim được hơn 3 năm rồi và đang rất vừa ý.,119,28
3027,1,huawei gr5 chạy rất mượt,27,5
3028,1,"lenovo k5 plus bạn ạ, rất tốt mượt, chụp ảnh đẹp",48,11
3029,1,"htc e8 dual đi bạn, đáp ứng đầy đủ yêu cầu của bạn, mình đang dùng rất ổn",73,18
3030,1,"xiaomi mi 4c ấy, 2 sim ,đời mới s808 camera lấy nét nhanh.hàng mới bh 1 năm cửa hàng ở vn bản 3 gb 32 gb khoảng 4 tr 5 thôi",125,32
3031,1,asus nay thiết kế đẹp thật,30,6
3032,1,"đẹp quá, cả 3 mẫu đều đẹp không chê vào đâu được, cũng không thấy dải nhựa ăng ten đâu nữa luôn, nói được là làm được. ủng hộ asus.",131,30
3033,1,asus ngày càng hoàn thiện mình,30,6
3034,1,"dùng asus zenphone 5, quả là chả đáng đồng tiền bát gạo",55,12
3035,1,đẹp quá deluxe,14,3
3036,1,zenfone 3 ultra nhìn đẹp nhỉ cười,33,7
3037,1,"mình sài zenphone 2 bản cao cấp nhấ khóc hì cũng test thử,mình ra quán cafe thử đừng truền wifi mạnh thử hết công suất của nó mình thấy thật bá đạo mọi thứ điều rất nhanh và mạnh nửa pin thì ngon hơn zen 5 hồi xưa.mún mua điện thoại nên mua zen 2 ram 4g trở lên đả hoàn thiện rất đáng mua.",278,62
3038,1,"có tiền mình wuất con zen 3 duxlue 6g ram.aus 3 mẫu điều rất đep.sài nhiều asus rất ok,sài it ra oai thì iphone 6.nhưng mình đang sài zenphone 2 4g ram rom 64 chip 3580,mình thấy rất nhanh và mạnh,ủng hộ asus cố lên.nếu ai am hiểu về điện thoại thì đánh giá còn không hiểu đừng nên phán xét lung tung.",298,63
3039,1,để làm việc thì rất tốt.,24,6
3040,1,"đẹp đấy. nếu chụp ảnh đẹp thì tuyệt vời. đối với tôi thì điện thoại chỉ để nghe gọi, check email, lướt web, chụp ảnh, thỉnh thoảng chơi games. còn công việc thì đã có thinkpad hỗ trợ rồi.",187,38
3041,1,"quá khủng cho đội winphone, với cấu hình này thì đám android cao cấp chỉ có mà mang đi đập ruồi hết. cấu hình quá mạnh, chạy ổn định, gần như không có virus, giờ chỉ cần nhiều universal app nữa thì không còn gì để nói.",218,47
3042,1,"cấu hình này chắc chạy file .exe được luôn, bá đạo thât 500 gb lưu file sướng lòi",88,18
3043,1,cái nào cũng lưu trữ được 32g. tha hồ. lỡ như hết bộ nhớ thì để dành lưu ảnh cũng khoái.,88,21
3044,1,cái nào cũng lưu trữ được 32g. tha hồ. lỡ như hết bộ nhớ thì để dành lưu ảnh cũng khoái.,88,21
3045,1,"thiết kế đẹp, nhỏ gọn, rất tiện lợi để có thể mang đi xa dễ dàng. có mấy cái này thì đi công tác sẽ không sợ không có mạng nữa rồi.",131,32
3046,1,sam sung bất wifi thì vô đối rồi,32,8
3047,1,iphone luôn dẫn đầu công nghệ.....sai lầm của tôi là không dùng iphone sơm hơn,78,15
3048,1,tôi thích hệ điều hành ios vì nó là chuẩn cao nhất trong phân tầng lập trình di động,84,19
3049,1,mê quá !,8,3
3050,1,lei a 49 triệu là quá rẻ rồi còn gì?,36,10
3051,1,đẹp đây. tầm 6 triệu la súc ngay,32,8
3052,1,hay lắm. nokia đã quay lại và sẽ mạnh hơn xưa.,46,11
3053,1,tuyệt vời. hóng sự trở lại của một huyền thoại,46,10
3054,1,thích nokia nhưng thú thật không ưa cái z launcher tẹo nào,58,11
3055,1,mình nâng cấp cho 5 thường chạy rất mượt ổn định,48,11
3056,1,"mình up dùng rất ok, không sao cả",30,8
3057,1,9.2.1 vẫn cứ là ổn áp nhất. silver tôi dùng gần 2 năm nay mà vẫn y như lúc mới mua cười,86,22
3058,1,5s len 9.3.2 tốn pin hơn,24,6
3059,1,mình từ 9.2.1 vừa lên 9.3.2 xong sài ok . theo mình thì như vào một số pmem thì chậm 1 số thì nhanh hơn. máy chạy mượt. đỡ hao pin hơn. khuyên mấy bạn nên len ngay và luôn. 5s,175,41
3060,1,minh cung mới lên cho iphone 5s được 2 ngày thì dùng thất mượt hơn chua thật loi j,80,19
3061,1,mình đang dùng 6plush vừa lên ios 9.3.2 thấy mượt và ổn định mà,63,14
3062,1,minh cung lên 9.3.2 may chay ok pin trâu .mih lên 1thag roi ma chua thay vân đe ji,82,19
3063,1,mih đa lên 9.3.2 may chay ok pin thi không pai nghi nhe . mih lên được gan 2 thag roi ma chua thay bi van đe ji,106,28
3064,1,mình cũng dùng 5s vừa lên 9.3.2 thấy dùng vẫn mượt mà,53,12
3065,1,rất nhanh và mượt mình rất thích,32,7
3066,1,mifh ipad air từ 9.1 lên 9.3.2 vì vợ lỡ tay bấm lên mà không biết dừng lại. máy chạy ngon hơn 9.1. pin thì mìh thấy có vẻ vẫn thế. được cái night shif hay. vì mìh hay đọc báo buổi tối. nói chung 9.3.2 mìh thấy được đó,210,50
3067,1,đang dùng 5s lên 9.32 xài ok,28,7
3068,1,"4s ỏ nhà có 2 con lên rồi có thấy bị j đâu,chạy ngon mà...........",66,15
3069,1,4s lên bình thường nhé.xài tốt chạy phà phà.,44,9
3070,1,4s moi len chay pha pha khoi lo up thoai mai,44,11
3071,1,ip5 lên được chạy mượt pin ổn đing hơn 9.3.1,44,10
3072,1,ip5 lên chạy mượt bin ổn hơn 9.3.1,34,8
3073,1,iphone 4s lên 9.3.2 chạy ầm ầm nè. chỉ để nghe gọi thôi. mua 6s plus để giải trí,80,19
3074,1,lên được bình thường. chạy tốt nha bạn,38,8
3075,1,"mình mới lên hôm qua, củng ok lắm. pin với mở khoá vân tay ngon hơn. chế độ đọc báo ban đêm cho phép mở khi ở chế độ tiết kiệm pin",129,32
3076,1,pin trâu cả tháng nhé!,22,5
3077,1,kiểu dáng rất đẹp hi vọng apple nhanh ra mắt tới người tiêu dùng,64,14
3078,1,"như thường lệ ra ip5 tôi mua 3gs, ra 6 tôi mua 4s, nay ra 7 sẽ lên con 5s . sài hàng cũ mà mượt lắm. tuyệt vời",110,29
3079,1,"vận động viên ở hồ bơi, cứu hộ này nọ hoặc lái tàu, thuyền buồm du lịch nữa...khá ngon, đa dụng",95,21
3080,1,quá xuất xắc,12,3
3081,1,"ios thật là ổn định, cứ ra bản mới thì phải có vài lỗi để người dùng trải nghiệm.",81,19
3082,1,"thần thánh, đại đế, sang chảnh, mượt mà, bảo mật, nâng cấp thường xuyên...",74,14
3083,1,có thấy lỗi gì đâu nhỉ. vẫn chạy ầm ầm này. cười vừa tối qua mới up lên cho iphone với ipad xong. các thánh chém ghê quá.,121,28
3084,1,tôi vừa update xong mượt lắm nhé,32,7
3085,1,"điện thoại samsung này còn mạnh hơn cả iphone thế hệ mới nhất, tuyệt vời.",73,15
3086,1,thay đổi đột phá về kiểu dáng quá _ !,38,9
3087,1,cảm ơn iphone đã có những siêu đột phá mới . giúp tôi tiết kiệm được 1 khoản không hề nhẹ,89,21
3088,1,5s vẫn đẹp nhất!,16,4
3089,1,"ta xài con ip 4 từ lúc mới ra cho đến giờ có ai chê lỗi thời đâu cười . vẫn nghe gọi lướt web tốt chán , lại thuận tiện",118,31
3090,1,samsung a9 pro dung lượng khá cao.,34,7
3091,1,có mấy chiếc philip đó bạn pin cực trâu bạn mình xài nó bảo được đến 5 ngày,75,18
3092,1,"có chứ điện thoại k10000 bảo đảm về pin, cấu hình tạm ổn, dùng vô đối",61,15
3093,1,được như này thì nhất định phải sắm 1 e và 1 cái doc để nâng cao sự chuyên nghiệp trong mắt khách hàng. chất vật vã,115,27
3094,1,thiệt là bá đạo,15,4
3095,1,siêu kinh điển. thật tuyệt nếu sở hữu 1 em,42,10
3096,1,"tuyệt vời ông mặt trời, order ngay và luôn thôi",47,10
3097,1,kể ra note 5 làm được cấu hình mạnh vậy cũng khá là hay ! nhưng người tiêu dùng chúng tôi khi xài cellphone thì cần hiệu năng và sự mượt mà nhiều hơn ....,154,35
3098,1,note 5 android 6 chạy mượt mà.,30,7
3099,1,mình thích iphone với tai nghe không dây đỡ vướng víu,53,11
3100,1,ip ram 1g chạy đã nhanh hơn ăn roi ram 3g rồi.nếu ip 7 lên ram 3g thì sẽ mượt thế nào nữa đây,93,24
3101,1,"trời, đẳng cấp",14,3
3102,1,ip7 pro mà hỗ trợ thêm cây bút nữa thì tuyệt vời,48,12
3103,1,"chùi ui, thích quá. mong em sớm ra",34,8
3104,1,"đang sài em 32e310, thấy cũng rất ok, màu cũng đẹp!",51,11
3105,1,"tôi xài m7 từ lúc mới ra tới giờ, không có lý do gì để đổi máy khác, phần cứng và phần mềm rất tuyệt vời. tôi vô tình làm rớt từ độ cao hơn 1 mày không dưới 10 lần mà giờ sử dụng vẫn ok ngoài cái võ bị xước",198,52
3106,1,"tôi đang dùng m7 từ lúc mới có one, đến giờ vẫn ổn, kiểu dáng không bị lỗi thời, nói chung nếu giá vừa phải thì em này vẫn ngon hơn nhiều em khác.",146,34
3107,1,"i love htc, 8 years ! since 2007, with 7 models",47,11
3108,1,"sẽ lấy em này, tôi xài htc từ lâu, hiện tại chỉ dừng ở one m8 nhưng thấy hài lòng về sản phẩm của htc.",96,24
3109,1,mình dùng m7 2 năm rồi mà vẫn mượt mà như mới! có tiền xúc ngon này ngon tuyệt! love htc!,89,21
3110,1,"duyệt rồi đấy lúc đầu tưởng chỉ có bản life stype giớ bán bản snap 820 thì hốt ,đến lúc cho bé 8x về vườn 3",108,26
3111,1,love htc love sense,19,4
3112,1,"tôi đã dùng one m7 được hơn 2 năm rồi. máy luôn ổn định, cảm ứng mượt, âm thanh khi xem phim và nghe nhạc hay hơn mấy dòng tương đương. giờ nhìn con htc 10 này không chê vào đâu được, nếu giá mà thấp hơn một chút thì tốt quá. i love htc!",234,55
3113,1,"vẩn là fan trung thành của htc từ thời windows phone 6 , vẩn không thể có giao diện nào qua khỏi htc sence của htc",127,26
3114,1,hàng htc quá chất. htc 10 vừa đẹp sang trọng lại đẳng cấp.,58,13
3115,1,tớ đang bphone phải nói ngon dùng sướng nếu là bản 64gb thì quá sương luôn,74,16
3116,1,"cũng đang xài 1 cái bphone, màn hình đẹp, pin tốt, dùng sướng. chỉ phải cái là bản 64g, chắc phải đổi sang 128g quá.",116,25
3117,1,"mình rất hay ra các cửa hàng lớn nhưng chưa 1 lần nào được thấy bphone vơ sần 1, mình lạc hậu quá rồi chăng?",108,25
3118,1,"chỉ có thể là bphone 2 hóng chờ em quá, hy vọng nhiều công nghệ nhất nữa làm rạng danh hơn cả bphone 1 cố lên các em",116,28
3119,1,"bphone 2 ngon thế, tiếc qua vừa mua bphone1 rồi.",48,10
3120,1,hay quá bkav. dùng bphone 1 đã thấy ngon rồi thì không biết bphone 2 con thế nào nữa.,85,19
3121,1,yêu quá. ra phát là xúc luôn. không phải nghĩ.,46,10
3122,1,"khách quan mà nói thì b1 thấy ngoại hình cũng ổn nhưng không biết trải nghiệm thực tế như nào, cũng chỉ tại không có tiền mua",119,27
3123,1,thực sự phê. tiếc là mình bình dân nên chưa mua được.,53,12
3124,1,"ủng hộ, tôi sẽ mua tặng vợ 1 cái b2",35,10
3125,1,mình vừa được trải nghiệp bphone xong. rất ok!,46,9
3126,1,hồi hợp mong chờ siêu phẩm ra mắt!,34,8
3127,1,đẹp ! giá hợp lý !,18,6
3128,1,"đẹp ,cấu hình ngon, mà mình sài htc rồi máy bền thật",52,12
3129,1,đẹp quá điiiiiiiiiiiiiiiiiiiiiiiiiiiiiiii,41,3
3130,1,con này ổn đấy chứ.,19,5
3131,1,pin khủng,9,2
3132,1,minh dang sai m8 thay rat được.,29,7
3133,1,"ai đã xài htc rồi thì mới có ý kiến,chỉ vì thích khoe bản thân nên ráng chọn hàng thời thượng thôi, ngay tôi cũng vậy nhưng vẫn giữ em htc để ở nhà bền lắm vật lên vật xuống có chịu hư đâu",188,44
3134,1,"cá nhân tôi thấy thiết kế tổng thể thiết kế của con p9 này đẹp hơn ip rất nhiều. rất đẹp, mạnh mẽ, nam tính.",108,25
3135,1,"máy đẹp đó, chất lượng hoàn thiện cực tốt, cấu hình ngon, bền , pin ngon, nhưng máy tq thì cho không lấy, thấy không xin",120,26
3136,1,"ý kiến cá nhân điện thoại của huawei rất tốt, đáng đồng tiền. hài lòng với tiền bỏ ra.",79,18
3137,1,mình dùng cái pad 2tr9 cho trẻ con cũng rất ok,46,11
3138,1,"tôi đang dùng huawei g8 sản xuất cho thị trường châu âu, máy rất tốt, không có gì phải chê. không phải đơn giản mà trong mấy điện thoại tq, chỉ có huawei vươn lên được đứng thứ 3 thế giới sau samsung và iphone.",210,45
3139,1,"nhiều người kỳ thị hàng trung quốc trong khi chả hề biết nhiều thương hiệu tq như huawei hay xiaomi đều lọt top những thương hiệu smartphone hàng đầu thế giới, cả chất lượng và trải nghiệm đều xếp trên sony hay lg.",214,43
3140,1,đang dùng huawei gr5 thấy ổn mà,35,7
3141,1,dep qua,7,2
3142,1,giá quá hợp lý,14,4
3143,1,siêu phẩm chạy android đáng mua nhất hiện nay,45,9
3144,1,trông đẹp và khỏe...nhưng không đủ xiền.,40,7
3145,1,ngày xưa xài p910i xài cổng 2.5 thấy rất thuận tiện và hợp lý. đặc biệt là tai nghe jin 2.5 của p910i nghe cực sướng!,117,26
3146,1,"các hảng sản xuất hay dùng chiêu bài tiện lợi, tiến bộ, sành điệu.v.v... tất cả chỉ một mục đích duy nhất moi tiền người dùng. còn những chi tiết kỹ thuật nào chưa khắc phục được thì cứ lờ đi mà thôi.",202,43
3147,1,tuyệt vời...!,13,2
3148,1,"blackberry dù không còn được như xưa nữa, nhưng xài sản phẩm của bbry có cảm giác an toàn và thể hiện được phong cách và cá tính của mình.",124,29
3149,1,"chỉ thích bbos, bb chạy android bây h giống như apple sxuat tivi. bbos kho ứng dụng nghèo nàn nhưng độ ổn định cực tốt, tại sao không bỏ tiền ra phát triển cái bbos mà phai chạy theo cái hdh mở lởm chởm, chắp vá, được cái trực quan, dễ phát triển tý chứ android ngốn ram, ngốn đủ thứ,virus hoành hành. android giống như lắp 1 chiếc xe đồ chơi chỉ có 4 cái bánh còn phần trên ai muốn lắp gì cũng được, được nhiều nguời thích vì nó thị hiếu, gần giống như nhạc của sơn tùng mtp. đó là ý kiến cá nhân.",569,108
3150,1,cũng vì hoàn cảnh đẩy đưa ghôi bạn. mình cũng rất thích hđh củ của bbry.,72,16
3151,1,có bàn phím là thích rồi,24,6
3152,1,"mau mau ra em room, hốt liền, bàn phím của blackberry luôn tuyệt với, kết hợp với android nữa quá tuyệt, nhất là android n sau này, mong bb luôn có những sản phẩm độc đáo",170,36
3153,1,porsche style! nếu giá hợp lý phải quất con hamburg,51,10
3154,1,yêu blackberry,14,2
3155,1,"chất lượng của bb phải nói là tuyệt, phong cách, cá tính...nếu giá mềm tí thì bb sẽ lấy lại thời huy hoàng của mình",115,25
3156,1,"thích bb vì kiểu dáng của nó, không dụng hàng ,nổi bật giữa đám đông.",66,15
3157,1,"ai bảo ra toàn điện thoại tốt làm chi. mình dùng pp được gần 1,5 năm mà không lỗi lầm gì thì làm sao mà mua máy mới được buồn",120,30
3158,1,chỉ có thể là blackberry. i love bb!,36,8
3159,1,"màu quá đẹp, quá độc",20,5
3160,1,"màu đẹp vậy? có cả lte cơ à, con này mua có được tặng thêm tai nghe hay gì không nhỉ?",82,21
3161,1,"nắp lưng đẹp vậy, màu này phù hợp với giới trẻ và các lứa tuổi sinh viên.",73,17
3162,1,mình có con lumia630 được 2 năm.dùng vẫn ngon lắm.,50,10
3163,1,đang dùng 4s và hoàn toàn mãn nguyện,36,8
3164,1,"mình có 1 cặp 3gs 8g, một em ip4, 1 em 2g len hinh nhung kg vuot được, đang để ngắm chơi, nhưng phải công nhận các em vẫn chạy tôt. hihi",134,32
3165,1,đẹp đó.,7,2
3166,1,thiết kế đẹp thật. phải chi đổi tên oppo thành bphone thì hay quá.,66,14
3167,1,nhìn kỹ thiết kế đẹp hơn ip chứ _,35,9
3168,1,quá đỉnh !!! ôppo sẽ đánh tan iphone vào 2018!!!,48,10
3169,1,đẹp hơn iphone chứ,18,4
3170,1,nhìn mà chảy nước miếng...,26,5
3171,1,"thiết kế đẹp, công nghệ cao, nhiều tính năng hữu ích, giá bán cực hấp dẫn. chắc mức lời trên mỗi sản phẩm rất thấp nhưng như vậy người tiêu dùng mới được sử dụng sản phẩm đúng với giá trị thực, không bị coi là hút máu chứ.",222,49
3172,1,quá đẹp.,8,2
3173,1,2 sim ngon quá,14,4
3174,1,siêu phẩm của những siêu phẩm. đẹp đấy samsung.,47,9
3175,1,nhìn là đã thấy yêu rồi! phải mua một em ngay mới được!,55,13
3176,1,"hic lỡ tay mua iphone 6s rồi, chắc năm sau mới mua em này được keke! cười",71,17
3177,1,qua ngon qua nguy hiem thay ma rat thich,40,9
3178,1,đẹp quá nhưng yêu dòng note mất rồi hóng tới t9 ra note 6.,58,14
3179,1,"hi. mình cũng đang hóng note 6 ra để mua ... note 4, hy vọng lúc đó note 4 sẽ còn khỏang 8t. note 6 thì quá đỉnh, mình không chống nổi.",135,32
3180,1,đúng vậy. note mới là dòng điện thoại anh cả của samsung cười,59,13
3181,1,đẹp,3,1
3182,1,ngon,4,1
3183,1,đã trải nghiệm s7 edge và công nhận đội ngũ thiết kế của samsung đã tạo ra được một tuyệt phẩm. trước giờ mình dùng sản phẩm của apple nhưng lần này samsung đã tạo được một nét chấm phá lớn trong thiết kế sản phẩm của mình.,223,48
3184,1,"ss năm nay về ngoại hình, cấu hình rất tốt. chờ đánh giá khoản pin nữa. sao không thấy bản chay wp nhỉ?",103,23
3185,1,"may quá đang định xuống tiền mau iphone 6s 64gb, giờ găp em này quất luôn lại dư được ít tiền",93,21
3186,1,mê quá mà không đủ khả năng buồn,27,8
3187,1,quá hấp dẫn mình thích nhất là ở khả năng chống nước,52,12
3188,1,thật sự thì mình rất rất thích s7 và s7 edge nhưng chắc phải chờ hạ giá mới mua !,81,20
3189,1,"thích quá, ráng cày đến khi đủ tiền mua được s8",47,11
3190,1,"đẹp quá. rất gọn gàng, sắc nét.",31,7
3191,1,"hy giá sẽ tốt hơn vào một vài tháng tới, quả là siêu phẩm cười",60,15
3192,1,rat dep,7,2
3193,1,"rất đẹp cười mình không hiểu sao các hãng lại cứ thi nhau làm viền mỏng, nhìn rất xấu mình thấy viền màn hình như máyny là hợp lí cười",130,31
3194,1,"chính xác, hàng cao cao cấp ultra envy của hp cực tốt. tôi đang dùng hp chạy amd a8 rất hài lòng, nhất là xử lý đồ họa rồi seri và true audio",140,33
3195,1,tuyệt vời 2 sim và 1 khe cấm thẻ giá 14tr quá ngon cho đội lg.,62,16
