,Class,Data,char_length,word_count
1465,-1,hàng philips này mà hỏng thì vứt xó có 1 điện thoại philips pin trâu rốt cuộc mua về xài giờ hư pin không mua được hãng bảo hành thì không có chán hàng philips quá,149,35
1466,-1,1 tính năng thừa . mất nhiều tiền mua smatphon rồi lại để trong túi rút cái điện thoại dỏm ra để nghe thì nó giải quyết gì . rồi lại bật blutoot suốt thì để tôn pin a đúng là nực cười . 1 chức năng sớm chết yểu,202,49
1467,-1,"hàng lg mới hay lỗi vặt nhé, đột tử lúc nào không biết",54,13
1468,-1,"các dòng tầm trung của lg bị nhược điểm là màn hình rất dễ bị loạn cảm ứng. trước mình đã thử qua dòng lg optimus g pro, hiệu năng ổn nhưng mà lúc hư cảm ứng thì rất khó chịu, đã sửa nhưng tình trạng vẫn bị. pin kém nữa.",220,51
1469,-1,"quá mắc so với giá trị thật, dòng phổ thông của lg thì lỗi rất nhiều, nhất là loạn cảm ứng và màn hình ám vàng,. khoảng 4,1 triệu có thể mua zenfone max pin 5k, cấu hình trên hẳng con này, dùng bền hơn nhiều.",208,46
1470,-1,"zenphone màn hình xấu, nhat màu, pin kém.",41,8
1471,-1,pin it za .phai được 3000 thi ngon,32,8
1472,-1,mua con xiaomi rmn2 còn ngon hơn cười,35,8
1473,-1,không có gì đặc sắc. vậy mà tuyên bố hùng hồn thấy ghê.,55,13
1474,-1,"máy htc one v khi xưa của mình vừa mua xong đã phải bảo hành, không được up android, sensei chạy rất lag và nặng, loa kém hơn iphone thấy rõ. từ đó mình ghét htc.",162,36
1475,-1,"mình không thích bầu bầu ở giữa như vậy, mà cam lại lồi nữa chứ buồn",66,16
1476,-1,phần viền màn hình màu đen vẫn còn dày chán buồn,46,11
1477,-1,mặt sau giống m7 mặt trước giống a9 nản luôn cười,51,11
1478,-1,hên quá chưa mua iphone . tệ hại thế .,38,10
1479,-1,đang xài iphone 6 mình ghét iphone lẫn blackberry,50,9
1480,-1,may mắn là mình mới lên đên 9.2 thôi nhưng mà lâu lâu mấy cũng bị đơ hoài,73,18
1481,-1,"thiết kế đẹp...nhưng android mà ram 1gb thì chán lắm,giật tung toé.",67,12
1482,-1,cảm ứng phillip dễ hỏng nếu vô tình dính giọt nước. còn dòng này ram thấp mà chạy android 5.1 nghe có vẻ không mượt,115,25
1483,-1,máy tính và điện thoại tq rất hay bị cài mã độc không nên mua,58,14
1484,-1,không thích oppo,12,3
1485,-1,"xiaomi ai dùng chưa? chứ tôi cũng thấy ớn rồi đấy vừa mua con mipad2 pin 6100mah sạc đầy tắt màn hình đúng 1 ngày 24 tiếng bật màn hình còn 75 wifi chưa tắt . thông thường các máy tính bảng khác như ipad mini khoảng 8 con này cầm pin nhất , samsung tab4 t531 xuống 12 . mình chỉ đề cập đến máy mới 100 thôi đó nha.",320,67
1486,-1,mi5 không có thẻ nhớ mà quát giá trên trời!,40,10
1487,-1,16 triệu thì sony sống sao ?? hóng so fan vào chém ợ,52,13
1488,-1,chắc lại ế như s6 thôi!?!,25,6
1489,-1,s7 không có hồng ngoại thì hơi tiếc,32,8
1490,-1,chả có gì đột phá. chán òm.,27,7
1491,-1,và camera lồi lên 3mm cười,24,6
1492,-1,"lại dẹt hơn, dài hơn, pin ít đi hả trời. tính bán phụ kiện hay sao mà dữ vậy.",77,19
1493,-1,"mỏng thì kèm theo dung lượng pin kém đi, không cần mỏng, dày 1 tí cũng được. người dùng chúng tôi cần tăng dung lượng pin apple ạ.",130,28
1494,-1,người dùng không cần mỏng đâu dày 1 tí cũng được chỉ cần thêm dung lượng pin apple ạ.,85,19
1495,-1,dày thêm 1mm nữa ok nhưng pin khủng lên tí là ngon mà cam khả năng cao không bị lồi!,84,20
1496,-1,mỏng thì sẽ dễ bị cong nếu bỏ trong túi quần..... gì cũng có cái lợi cái hại...,79,18
1497,-1,"thừa quá, chỉ cần s3 hay lg optimus g la đủ rồi",47,12
1498,-1,"giá đó thừa sức kiếm chiếc andoid chất lượng, giải trí ngon. chứ 5s mua làm sơ cua mà giá đó thì quá phí tiền. đã 4in còn lcd thì nghe gọi, nhắn tin thôi, giải trí thêm bực và đi viện chữa mắt chứ hay gì.",198,46
1499,-1,cứ cái kiểu bo bo tròn tròn như dòng iphone6 nhìn giống đồ nhựa. xấu không thể tin được đó là thiết kế của apple!,113,25
1500,-1,"ipad pro đã không hiệu quả, giờ lại iphone pro?",47,10
1501,-1,đừng có cái đường viền kia nữa! buồn,35,7
1502,-1,"sao nó không làm phím nguồn, âm lượng, bật tắt chế độ âm lượng chìm nhìn con dế sẽ mượt hơn biết mấy???",100,23
1503,-1,vẻ bên ngoài không mấy thay đổi ! làm cho người dùng cảm thấy nhàm chán,71,16
1504,-1,"3d touch chỉ để quảng cáo, có rất ít tác dụng",45,11
1505,-1,"sao ip không tăng kích cỡ lên 4,3 4,6 ich nhỉ. 4ich thì hơi nhỏ, 5ich thì to và thô.",84,19
1506,-1,"ầy, giá cũng chát gớm buồn",24,6
1507,-1,6in mà hd là không ổn.,22,6
1508,-1,"thiết kế mà tinh tế nỗi gì, dẹp dí dài ngoẳng như dép lào. icon thì xổ hết ra nên muốn để trống màn hình cũng chịu. ios càng ngày càng rườm rà. ss lg thì tiến lên, ip thì thụt lùi.",180,42
1509,-1,váyn đề là 500usd thì về việt nam bán cho ai?,45,11
1510,-1,viền mỏng quá cầm cứ bị lòng bàn tay chạm vào màn hình khó chịu !,65,16
1511,-1,"giá này hơi cao, về vn cũng khoảng 11 12 triệu. nếu vậy thì khó bán đây.",72,16
1512,-1,"thiết kế cứ na ná nhau, nhìn riết thì cũng bình thường không có đặc sắc nhiều kiểu như hồi đó",90,21
1513,-1,minh mua 1 cai gionee s5.5 duoc 5 thang hong khong biet sua ơ dau. cạch den gia luon,84,19
1514,-1,"mua hàng trung quốc với giá tầm 6 triệu , thà mua aiphon 4 , 5 với giá này xài sướng hơn",88,22
1515,-1,minh da xem va trai nghiem .nhung may không khoi dong duoc va gan nhu liet .ca nhan vien cung bo tay.,98,22
1516,-1,chưa biết nhìn thực tế nó thế nào. nhưng thiết kế vẫn chưa có được vẻ j riêng. cứ na na sam vá htc,98,24
1517,-1,"như thời ware tàu, đẹp long lanh thời đầu. vài tháng hoặc năm sau mới biết chất lượng",85,18
1518,-1,"mặt trước y chang samsung, cực ghét chữ mi ở mặt trước, nếu giấu ra phía sau thì nhìn đỡ hẳn, mác tàu có gì đẹp đẽ mà khoe, như dòng redmi note phía trước sạch sẽ là ổn.",169,39
1519,-1,"tiếc là màn hình điện thoại xiaomi thường xuyên ám vàng nhẹ, nếu xiaomi tập trung nâng cao chất lượng màn hình, màu sắc trong trẻo, đẹp như màn hình điện thoại sony hay apple thì tuyệt vời!!!",191,38
1520,-1,với giá này làm con a7 a8 samsung chẳng hơn sao,47,10
1521,-1,"trông máy còn hơi dày thì phải, mỏng hơn xíu sẽ đẹp hơn",55,13
1522,-1,xài 15 hết pin cười,18,5
1523,-1,mình mua s7 edge rồi. 4 inches quá bé buồn,41,10
1524,-1,"quay xong chịu khó chép ra ngoài, để trong máy làm chi, mất máy là mất tất cả. 16gb quay nghiệp dư clip ngắn ngắn cũng cả trăm clip, hình thì cũng vài ngàn ảnh chứ đâu có ít gì. chứa quá nhiều, mỗi lần tìm lại là cả một vấn đề!",227,52
1525,-1,1 clip của bạn 5 giây. 1 tấm hình giảm độ phân giải còn 2mb hay sao mà vài ngàn tấm. dân nghiệp dư mới để trong máy. ng ta chụp xong nó tự up lên cloud rùi,155,38
1526,-1,"chán ngán các sản phẩm của apple. chia tay từ lâu rồi không có hứng quay lại dùng, chẳng qua thấy các trẻ trâu tung hô nhiều quá vào noi vài câu",141,32
1527,-1,"sao cứ phải 16, 32, 64 nhỉ sao không phải là 20, 25 có ngon không. 16g cứ phải delete suốt, gặp gấu suốt ngày tự sướng thì xong.",128,29
1528,-1,"về kết nối 3g hay wifi thì ip cực kém và tốn pin quá trời. ip toàn trang bị chuẩn thấp, lạc hậu để giá thành rẻ mà. ifan dễ dụ lắm nên cúc làm gì chả được.",155,38
1529,-1,"thôi, bái bai iphone luôn, quá mất thể diện và quá kém cỏi. nên đuổi ngay tim cóc may ra có người làm tốt mới lấy lại được danh tiếng cho apple. giờ chỉ có samsung là lắng nghe người dùng thôi.",193,42
1530,-1,"nếu đây là kiểu dáng của s7 thì thật sự thất vọng, sản phẩm này thua xa s6 về thiết kế.",87,21
1531,-1,cả đời này tôi không báo giờ cầm đến ss vì ghét nhất camera lồi thấy gớm. lồi ít hay nhiều vẫn là lồi.,102,24
1532,-1,iphone đẹp hơn,14,3
1533,-1,vấn đề là khi touch id hư thì không sử dung được thôi. đáng ra khi restore lại thì đáng lẽ phải kích hoạt iphone lên được vì dữ lieu người dùng đã được xóa vậy mà vẫn còn lỗi. chẳng qua là apple dưới danh nghĩa bảo mật dữ lieu mà thực chat là muốn hạn chế sửa chữa để người dùng mua iphone mới thôi. bây giờ dính vào kiện cáo mới chịu buông.,342,75
1534,-1,không bik có ai để ý không nhưng khi bật chế độ tiết kiệm pin thì phía trên màn hình sẽ mặc định hiện lên 1 thanh màu xám. có thể nh ng sẽ không để ý nhưng minh thấy nó khá khó chịu .,174,45
1535,-1,chuẩn rồi đó bạn. mình cũng rất khó chịu vì cái này. loay hoay len google tìm cách xóa,86,19
1536,-1,mới lên sáng nay và bị lỗi wifi yếu thấy rõ và bị lỗi messege không gọi được nãn gê,83,20
1537,-1,vỏ nhựa là không thích rồi,24,6
1538,-1,"màn hình 5,5 pin có 3300mah mà đòi dùng 2 ngày, thật không thể tin nổi,chắc bán cho người adùng thỉnh thoảng lướt web, fb .... thì mới trụ được đến 2 ngày.",154,33
1539,-1,điện thoại chạy android và wp ngày càng quá khổ.,48,10
1540,-1,thà mua sony ngon hơn,21,5
1541,-1,cái này ra cạnh tranh với mixao được chứ oppo thì không có cửa rồi vì quá xấu.,78,18
1542,-1,"tưởng gì mới, vẫn màn hình dẻo ở giữa, pin nằm trái, bo mạch cứng nằm phải, quấn băng keo đen lại là xong. vẫn chưa làm được pin và linh kiện dẻo, đừng nói 5 năm, 5 chục năm nữa thì với công nghệ đó chẳng làm xong được. chỉ cố ý gây sự chú ý thôi.",245,58
1543,-1,màn hình dẽo chưa biết ứbg dụng ra sao. nhưng smartphone có màn hình dẽo mình thấy nó vô dụng và xàm xí quá. chả ai rảnh mà tối ngày lấy 2 tay uốn éo cái màn hình smartphone cả.,177,40
1544,-1,nếu nó dẻo ở mức độ nhất định bẻ hơi mạnh mới uốn thì tốt mà bạn vì khỏi sợ cấn vỡ màn hình hay nếu có rơi cũng yên tâm. nhưng vấn đề là viên pin nếu chỉ vì cái màn hình mà để điện thoại dài như thế là không chấp nhận được,215,56
1545,-1,asus làm rất tệ về độ sáng màn hình cười,38,10
1546,-1,cỡ tiền này thì cũng chả rẻ!,28,7
1547,-1,hy vọng là bản demo chứ bản chính thức mà như thế này thì nhìn như đồ tq,75,19
1548,-1,trời. cái cụm camera sau kìa. quá xấu,43,8
1549,-1,mặt sau nhìn giống điện thoại giá rẻ tq mấy năm trước thế nhỉ !,63,15
1550,-1,hy vọng đây không phải là g5 .vì mất hết những nét đặc trưng dòng lg.,69,16
1551,-1,"trời ơi, sao xấu thế này. đâu rồi những nét tinh tế của lg.",59,14
1552,-1,cũng có suy nghĩ giống bạn. đút 6s vào túi hơi cấn,50,12
1553,-1,mua 5s cũ là quá đủ xài rồi hơn con asus nhiều bạn ạ,52,14
1554,-1,"mình đang dùng xiaomi redmi note 2 và cảm thấy hối hận vì đã mua dù giá không đắt 2,9 triệu . chất lượng pin rất tệ, chư được một ngày dù không chơi game. các thông số khác cũng hơi ảo so với thực tế. mình nghĩ redmi 3 cũng vậy thôi. theo mình bạn nên tham khảo lg pro 2 trong cùng tầm giá đó.",291,66
1555,-1,"đang xài redmi3 nè , nhôm nguyên khối chỉ kém là phần 3d hơi thấp",65,15
1556,-1,"tránh xa cái chip mediatek ra nhé bạn, mình đang xài k3 note của lenovo, chip cực tệ. thêm cái là xài 2 sim nên dù pin 3000ma sẽ hao hơn so với điện thoại xài 1 sim. chờ redmi 3 giảm giá đi b!",183,44
1557,-1,mình xài em này bị đứng máy hoài à,34,9
1558,-1,"mình mới mua được 3 hôm cũng cùng ý kiến như bạn, không hài lòng về pin",71,17
1559,-1,"cáp sạc của apple là đểu nhất trong các hãng, dùng mấy bữa là toác hết cả dây.",78,18
1560,-1,"cái này thì quá chuẩn cười không bọc biếc cẩn thận là toác vỏ ngay, ruột thì cũng bền nhưng cái lớp bên ngoài hở cái là rách",120,28
1561,-1,"wp sắp chết rồi. hđh thiếu đủ thứ 2 năm qua chả có cái gì mới trong khi các hđh mới cập nhật ào ào, giờ làm bản win10 mobile mà hứa hứa nữa hứa mãi, microsoft quá xem thường khách hàng. lúc đầu tôi mua máy wp cũng nghĩ là máy ổn định và mượt nhưng khi xài theo thời gian mới thấy chán kinh khủng.",296,67
1562,-1,"không hiểu sao đang dùng microsoft 950 xl được quảng cáo là chiếc điện thoại tốt nhất nhưng dùng thì chậm vô cùng, facebook vào cực kỳ chậm và máy thường xuyên bị treo do quá nóng, chuyển đến trung tâm bảo hành thì báo máy nó như thế. rất thất vọng thì sản phẩm giá thì cao nhưng tiện ích mang lại không như ý muốn mặc dù điểm mạnh của chiếc điện thoại này chụp hình rất đẹp",374,80
1563,-1,được cái ngoại hình đẹp mà cấu hình lởm quá !,45,11
1564,-1,đẹp..nhưng chán dùng wp rồi!,28,5
1565,-1,tôi cũng mới đọc tin. mà chip chán quá. cam 13 thì cũng nhắm mắt mua. có điều vẫn băn khoăn cái lượng pin. hi vọng bản xl pin được 2500,133,31
1566,-1,ôi cái cấu hình điện thoại mạnh kinh,32,9
1567,-1,"cấu hình khủng bố tinh thần quá, giá cũng đâu hấp dẫn gì!",57,13
1568,-1,"android nào lag thế? chắc lấy mấy con ghẻ lở đời cũ ra để nói, chứ mấy con đời 2015 ram 2gb trở lên là chả sợ lag. dùng wp thì chỉ có hối hận thôi",146,36
1569,-1,"theo tôi bạn nên chọn iphone hay điện thoại android mà dùng, bản thân tôi đang dùng 950xl và hoàn toàn thất vọng vì phần mềm quá ư là bất tiện, mọi thứ đều chậm đều và máy quá nóng, facebook thì post 1 tin phải chờ 2 3 phút mới lên. quá thất vọng với hệ điều hành windows 10 trên mobile và đang chờ cải tiến để tốt hơn.",319,70
1570,-1,"cùng tầm tiền với 2 sản phẩm trên thì bạn có thể tham khảo khá nhiều mẫu android cận cao cấp hoặc cao cấp. và với cấu hình của các sản phẩm android cận cao cấp trở lên thì vấn đề mà bạn lo ngại là giật lag sẽ hầu như không xảy ra. chưa kể khi cập nhật lên phiên bản hệ điều hành mới sẽ càng mượt vì android càng phiên bản cao càng mượt. mình khuyên thật lòng, bởi mình cũng đang dùng 1520 , thực sự là quá chán với kho ứng dụng của windows phone, từng hy vọng windows 10 mobile sẽ là một cuộc lột xác ngoạn mục, thế nhưng ứng dụng nghèo nàn và chất lượng kém thì vẫn không cải thiện được. ý kiến góp ý của cá nhân mình. mong rằng bạn sẽ có sự lựa chọn đúng đắn.",655,148
1571,-1,thực tế thi quá thất vọng,25,6
1572,-1,chả có con nào đẹp,18,5
1573,-1,"quá xấu vì không phải là samsung, thiết kế samsung khác hoàn toàn với apple. tính năng cần, chụp hình hơn note 5, dung lượng nhớ ít nhất 64 gb, fast charge, chụp hình 20 mpx, thiết kế khác apple.",196,40
1574,-1,galaxy nào pin cũng nhanh chai và bị nóng máy rất hay bị lỗi và nóng lên là chạm lung tung đứng máy hoài,104,24
1575,-1,sam sung dung đuợc may thang la may bi đơ chi co iso la ok,59,15
1576,-1,em thề là về quê em ở hải dương sóng còn không có trong ngày tết cơ. mạng 3g v hãy lướt theo cách của bạn. còn chậm theo cách của chúng tôi. cười,142,35
1577,-1,mạng 3g mà vài phút đã mất mấy trăm nghìn rồi 4g chắc nhà mạng nó rút 5 triệu 1 phút quá,88,22
1578,-1,"sony tốt hơn samsung 10 về trước thời non os lúc c901, 905, làm mưa làm gió thì đúng như z thật . sony giờ bảo thủ lắm , ngoài thiết kế ra thì không có gì có thể so sánh được với samsung đâu bạn .",191,47
1579,-1,đừng mua j7.am thanh thì nhỏ. sóng rất yếu bị mất sóng hoài,59,13
1580,-1,"nếu chọn 1 trong 2 máy trên thì mình khuyên bạn mua samsung vì sony m4 aqua đang vướng lỗi bộ nhớ trong còn rất ít để cài ứng dụng, bạn có thể google để rõ hơn, nếu thích sony bạn có thể mua dòng khác, good luck",211,48
1581,-1,"j7 đi bạn, camera cùng 13m nhưng m4 chụp hình xấu tệ hại luôn, khả năng bắt nét cực kém.",88,20
1582,-1,"chào em, em có thể xem trên youtube về đánh giá 2 sản phẩm này. nếu anh thì anh chọn m4, có tính năng chống nước. j7 thì có vẻ đẹp hơn nhưng về phần cứng thì không bằng đâu. máy chạy lag hay không là phần lớn do người dùng biết thao tác để tối ưu nha em. 2 máy điều có cấu hình tương đương, cũng khác là mạnh, em không sử dụng app nặng nhiều thì yên tâm về tốc độ xử lý.chúc em mau có máy mới sử dụng.",392,93
1583,-1,sony m4aqua dung giật lag lắm bạn ạ,35,8
1584,-1,"đừng ai xài của sony vì tôi mua sony experia m4 mau hết pin,nóng máy vô lý, còn nv bảo hành thì kg có 1 chút cảm tình.6.490.000 khi mới mua về thì đã bị cho tới bây giờ,tôi yêu cầu được đổi máy khác ngay khi mới mua 3 tuần nhưng kg được đổi.thất vọng quá",254,57
1585,-1,"mình đang xài con m4 đây chán lắm bộ nhớ trong chỉ có 8g thôi, có nhiều ứng dụng tải về không chuyển sang bộ nhớ ngoài được nên rất mau đầy khuyên bạn nên dùng j7 là không hối hận bạn nhé",187,43
1586,-1,"thời buổi này còn coi chụp ảnh và nghe nhạc là thế mạnh của sony? tôi dùng vài đời sony và đã quá thất vọng, sau đó chuyển sang lg, samsung đều thấy hơn hẳn sony",161,36
1587,-1,mình chưa xài j7 nhưng mình đang xài cái sony đó được 2 năm mình thấy nó ok...chỉ mỗi tội thấy loa sony hơi nhỏ...nghe nhạc phải để gần không thì xài phone thôi....nghe nhạc nhiều thì bất tiện...,193,39
1588,-1,"sony hay lỗi mà lắm, quanh nhà mình mua sony gần như đi gần hết sau 3 năm, may cái nhà mình còn bh 2 năm nên thay kịp không mất tiền buồn",131,32
1589,-1,"lên bản mới pin để từ tối đến sáng không xài tụt pin gần 25 , đang hối hận vì nâng cấp đây",90,22
1590,-1,"xài đồ apple bực mình lắm , 1 năm là ra cái mới trong khi cái cũ xài hoài không hư",82,21
1591,-1,4s cua e vua nang 9.2.1 thi nút home liệt nan ghe,51,12
1592,-1,có ai dùng 6s lên 9.2.1 lại nhanh hết pin như tôi không. nhanh hết pin quá,74,17
1593,-1,"suốt ngày vá lỗi, thua luôn apple, kiểu gì cũng vẫn lỗi.",56,12
1594,-1,mình dùng máy iphon 6 plus tải ios 9.2.1 về máy bây gio dùng lag thế không být,78,18
1595,-1,"mình không rõ bạn mua phiên bản r6 hay r7, nhưng nếu là mình thì mua con mày audio av42 ngon hơn.",95,21
1596,-1,"dúng rồi đó bạn, zen chup anh quá tệ, thua ca cái samsung dưới 3 chai",69,16
1597,-1,"g4 mình cũng mua zenfone 2 ma thường bị đứnghoài ghét , hối hận",71,14
1598,-1,"không nên mua zenfone 2 màn hình xấu, chip intel chưa hoàn toàn tương thích với một số phần mềm, chụp hình bình thường, pin cũng chả xuất sắc gì...",148,30
1599,-1,"chia sẽ với các bạn tý. mình đang dùng zenfone 2. thật sự thất vọng với những gì mình đã mong đợi. máy có độ sáng màn hình thấp. ra nắng là mù luôn. rất hay lỗi mất sóng, đôi khi đang nghe ai đó gọi đến,tự nhiên mất sóng, ngắt cuộc gọi giữa chừng làm họ tưởng mình không thích nghe, thật bất tiện. nghe nói đa số dòng zen 2 lỗi mất sóng và sóng yếu, chụp ảnh không đẹp tuy camera 8 chấm. chỉ được một điểm cộng duy nhất là có mặt kính cường lực chống được trầy sướt nên khỏi phải dán màn hình. không bao giờ dùng asus nửa",521,115
1600,-1,"một lần mua z1 chính hãng nhớ đời, dùng được 1 năm thì vỡ màn hình gẫy luôn con victor barave sword 12 trong cùng 1 ngày, ra thay mất 4tr2, thay về được 2 tháng thì lỗi main mới cú. mang ra phán 4tr5 thay main, em xót tiền quá, mang về. mang ra hàng điện thoại bán, xác máy 1tr5, em xót quá mang về làm kỷ niệm. giờ chỉ mua hàng xách tay của nhật, giá hợp lý mà bền.",371,85
1601,-1,chup hinh xau lam,17,4
1602,-1,giá này mua v10 cho ngon,24,6
1603,-1,lenovo chụp hình xấu nhất cõi đời . mua dùng thử đi rồi bít,59,14
1604,-1,"xài nhanh xuống máy lắm e ơi , tầm giá đó chọn g3 ngon hơn .",60,16
1605,-1,"g2 loạn cảm ứng, g3 hay tắt nguồn, g4 hay chết mainboard. biết thì khuyên không bít thì thôi...khuyên bậy hại người ta",115,23
1606,-1,"điện thoại của mobistar khá rẻ, và mình nhìn vào giá cả các thông số kỹ thuật của con prim x cũng mê lắm, tuy nhiên nhớ lại 5 lần 10 lượt đi bảo hành cái 452 kem thì lại thấy ngán quá đi thôi.",197,46
1607,-1,"điện thoại này chế độ bảo hành rất tệ, mình có mua 1 cái bị hư phần cảm ứng đến bảo hành họ bảo đổi cái mới, và bù tiền rất nặng.",129,32
1608,-1,nhược điểm là thiết kê quá phẳng và loa để ở sau lưng nên để trên mặt bàn gần như không nghe thấy chuông,104,24
1609,-1,ai có ý định mua primex thì mình khuyên hãy suy nghĩ lại.mình mua một con từ lúc chưa có hàng phải đặt mua onl.nhưng chưa được 1 năm thì cái được gọi là nhôm nguyên khối của primex bi bong ra.va no chỉ là viền kim loại ngươi ta gắn keo.thật kinh hoàng,251,54
1610,-1,đọc những dòng của bạn thì mình thấy ipad cũng lắm lỗi nhưng vì có giá cao nên người ta chắp vá để bán lại.,107,25
1611,-1,giá hơi cao. đành đợi 1 năm nữa rồi lấy em.,43,11
1612,-1,mặt trước màu đen không hợp với màu vỏ sau lắm,46,11
1613,-1,"bạn đăng bài ghi sai kích thước màn hình model a7 2016 chỉ có kích thước 5.5 thôi. giá này mà samsung đưa ra vẫn hơi chát so với cấu hình như vậy, chưa nên mua vào lúc này!",175,39
1614,-1,"cấu hình bèo mà đòi đú.....zenfone selfie cũng 6 triệu 5 mà camera trước 13mp, màn hình full hd....không cạnh tranh nổi đâu!!",125,23
1615,-1,oppo là hãng điện thoại nào mà giá trên trời vậy nhỉ.,53,12
1616,-1,đúng thế con neo 7 màn hình qhd mà giá gần 4trieu mình không hiểu oppo định giá kiểu gì ảo tưởng vô cùng.,102,24
1617,-1,vừa lên kệ hí hứng và nhận ra em nó quá tệ so với số tiền bỏ ra đúng là hàng trung quốc mà ảo tưỡng về giá,106,28
1618,-1,"mọi thông số của còn này đều thua hẳn selfie, nhưng lại có cùng mức giá bán thì nghĩ cũng khó sinh tồn thật. ram cũng 3gb như selfie chứ đâu có hơn",147,33
1619,-1,oppo ảo tưởng giá quá,21,5
1620,-1,con này thua con selfie rất nhiều chỉ được cái ram 3gb còn lại thì không sánh bằng con zenfone selfie được,106,22
1621,-1,sony c5 camera trc 13 mpx chup hinh con thua oppo. oppo selfie dep thiet,72,15
1622,-1,dòng smartphone giá rẻ muôn đời ra công không được tốt và linh kiện cũng không được ngon nên hay bị lỗi vặt và chết màn. ai may mắn thì dùng được máy ngon,140,34
1623,-1,"vẫn kiểu dáng thiết kế xấu, vẫn chất liệu nhựa rẻ tiền như ngày nào. hy vọng chất lượng khá hơn zen5",100,22
1624,-1,tớ không chê xấu. nhưng asus nhìn như không thoát được thiết kế này. nếu bỏ qua màu mè thì khi đặt gần nhau giữa các dòng điện thoại asus chỉ là sự phóng to thu nhỏ của một nguyên mẫu. quá đơn điệu.,188,43
1625,-1,"tôi đã dùng qua,và mua giúp mấy người bạn gần 10 sản phẩm của asus, thực ra vì tôi bị eo hẹp về kinh tế...thấy rẻ, thì xài thôi nhưng thật công bằng thì asus kiểu dáng xấu, thô, mau xuống mã, khó chịu nhất là ăn pin khiếp quá...",228,50
