,Class,Data,char_length,word_count
3945,0,"review đây này, hiệu năng tổng thể ở full hd card này cũng chỉ chơi được tầm đó, lên cao hơn chắc lết là ngang với 950, bị 960 bỏ xa tít tắp. mà đấy là bản oc của asus so với bản thường của 950. con 460 này hiệu năng fail lòi, 470 mạnh gấp 1.7 lần, còn 480 mạnh gấp đôi, 1060 hơn 2 lần. thử so sánh p p nếu con 460 giá tầm 3tr5 thì còn thua cả mấy con 1060, giá gấp đôi nhưng hiệu năng hơn gấp đôi. https www.techpowerup.com reviews asus rx_460_strix_oc 24.html asus radeon rx 460 strix oc 4 gb review amd s radeon rx 460 promises entry level gaming for the masses, with pricing starting at 109. we are reviewing the asus rx 460 strix oc, which comes with 4 gb instead of 2 gb and an additional 6 pin power connector, at a 140 price point. techpowerup.com",761,148
3946,0,"giá thì cũng có nhiều giá lắm mỗi hãng có mỗi giá khác nhau . gtx750ti từ 2,9tr 3,3tr gtx950 từ 3,8tr 4,8tr gtx 960 từ 4,8tr 5,7tr",137,30
3947,0,"vulkan là từ xác mantle của amd đi lên thì đương nhiên ít nhiều cũng ưu ái amd hơn chứ, bác thử check game doom bật vulkan async compute các kiểu coi, vã vỡ mồm card nvidia",172,37
3948,0,"điều amd muốn nhấn mạnh ở dòng polaris này là hiệu năng trên giá thành, với tình hình hiện tại hiệu năng thì cũng tạm so với mong đợi nhưng giá thành thì trên trời đâu không biết chứ vn là fail rồi",200,44
3949,0,anh đang nói 2g hay 4 g thế mà có ngang thì chỉ ngang với gtx 950 không nguồn phụ thôi,86,21
3950,0,bạn này nghĩ gì mà dám bảo nvidia 960 thua amd rx460 vậy ? kể cả trong tương lai khi amd update drivers cho rx460 đi nữa thì mình cũng không nghĩ nó mạnh tương đương 960 được.,175,38
3951,0,"có vẻ là r7 260x đổ xuống vẫn có chỗ đứng, rx để thay máu dòng r9 cũ kỹ và tốn điện thôi. thôi mai ra xúc r7 260x hay gtx 750 luôn cho nhanh khỏi chờ đám còn lại.",162,40
3952,0,750ti chơi tốt gta 5 đấy,24,6
3953,0,giá gốc có 100usd cho 2g và 4g là 120usd... đôn giá thế....,59,13
3954,0,"asus 4bg là em nào? ý bác là em rx 460 4bg đó hả? mà 2 em trên về điểm p p, nhiệt độ tỏa ra khi cày game, thì chênh lệch nhau như thế nào? có nhiều không?",143,36
3955,0,"nhiệt toả như nhau, hiệu năng ngang bằng, chỉ khác là giống như gtx 10xx rx 460 còn được hỗ trợ nhiều năm nữa và hiệu năng sẽ tăng sau các bản cập nhật driver. còn gtx 950 sẽ sớm ngưng support và hiệu năng dậm chân tại chỗ, đến khi có gtx 1030 hoặc 1 card nào khác thế chân thì còn có khả năng bị bóp giảm hiệu năng nữa cơ",322,73
3956,0,cười đám rx sẽ còn được support lâu chờ dx12 thay thế các game dần thôi cười,72,18
3957,0,"1 thanh 8gb, sau này up lên 16 vì thực tại bây giờ game chạy đòi rất nhiều ram, vga thì góp lúa đợi bản 1060 3gb thay cho 2 con trên đi, chứ game đòi dx 12 thật sự chạy khá nặng đòi phần cứng phải dạng nạc một chút, cỡ gtx 960 trở lên nhưng sẽ cho fps ổn định còn mấy cái vụ driver bóp dòng cũ thì chưa đúng lắm, vì driver mới buff cho tech của dòng mới, đâu thể đòi buff 1 công nghệ hỗ trợ dòng mới mà không tồn tại trên dòng cũ được, đương nhiên lúc đó mấy bạn cảm thấy fps nó tăng hiển nhiên là buf cho tech mới mà sao không tăng , còn trên vga cũ thì vẫn vậy do có tech đó đâu mà buff .",594,139
3958,0,"sao lại nói game dx12 nặng được nhỉ , nặng hay không do người làm game làm nhiều hiệu ứng hay không thôi chứ , không phải những game chỉnh api dx12 cho fps cao hơn hẳn so với dx11 sao",183,41
3959,0,"tại nvidia dùng tuốt chung driver nên cảm tưởng thế thôi, chứ như amd dòng nào dứt support là có bản driver cuối luôn rồi, như driver crimson chỉ support hd77xx r7 r9 rx thôi ấy. còn card đổ về trước nó ngưng sản phẩm luôn. nvidia cũng thế mà",238,50
3960,0,về dx 11 hay dx 12 minh cũng không quan tâm mấy vì mấy game mình chơi đa phần cũ cũ. game mà nặng quá không đủ thì thôi. mình cũng không ham hố có game này ra là phải chạy theo ngay nên rx 460 or gtx 950 là ổn với nhu cầu của mình rồi! đi làm cả ngày tối tối ngồi game giếc với bạn xíu cho vui thôi! vẫn đang nghe ngóng các bác để tháng 9 này ra quyết đinh chính thức! đồng tiền mình tự làm ra nên cân nhắc kĩ lắm lắm .,415,100
3961,0,"e dạo này toàn tư vấn con r7 260 xả hàng tray của mai hoàng giá 2m bảo hành 2 năm, còn r7 260 đợt trước mới ra bảo hành 3 năm toàn 3m theo quan điểm cá nhân con msi r7 260 giá 2m đang có p p tốt tại vn",201,51
3962,0,e xin mạnh dạn vote rx 460 vì sẽ còn được support nhiều năm nữa,61,15
3963,0,"không phủ nhận các dòng card thế hệ mới đang hướng đến việc nâng cao trải nghiệm với độ phân giải 4k và vr, tuy nhiên đôi lúc chỉ cần max setting ở fullhd là đủ để các game thủ ấm lòng. và đó là lý do mà dòng card gtx x60 rất được ưa chuộng, bởi sự phối hợp hoàn hảo giữa sức mạnh và giá cả. và liệu phiên bản mới nhất, gtx 1060 có đạt được kỳ vọng này hay không. mình sẽ cùng bạn tìm câu trả lời qua gigabyte 1060 g1 gaming, một trong những phiên bản custom của gtx 1060 đang được bán rất rộng rãi tại thị trường việt nam. thông tin về gtx 1060 gtx 1060 là dòng card thứ 3 thuộc thế hệ geforce 10 của nvidia. nếu như người anh em gtx 1080 và 1070 hướng tới phân khúc hiệu năng cao giá đắt đỏ, gtx 1060 tiếp tục truyền thống của các dòng card gtx x60 là chăm sóc cho các bạn game thủ với sức mạnh vừa phải mà giá lại cực kỳ phải chăng ít nhất là so với các dòng x70, x80 . điểm tuyệt vời đó chính là với geforce 10 series, nvidia đã có bước nhảy vọt về hiệu năng cho tất cả các dòng card của mình. và gtx 1060 cũng không phải là ngoại lệ, đặc biệt là với những phiên bản custom như gigabyte gtx 1060 g1 gaming thì hiệu năng thậm chí còn được đẩy cao hơn cả mức mặc định của nhà sản xuất. thông số kỹ thuật tên sản phẩm gigabyte gtx 1060 g1 gaming chip đồ hoạ geforce gtx 1060 pascal tiến trình sản xuất 16 nm finfet số nhân cuda 1920 xung nhịp 1620 mhz oc 1594 mhz gaming xung nhịp boost 1847 mhz oc 1810 mhz gaming bộ nhớ 6 gb gddr5 8 ghz giao tiếp bộ nhớ 192 bit số cổng kết nối 1 dvi d, 1 hdmi 2.0b, 3 displayport 1.4 kích thước 278 x 114 x 40 bộ nguồn đề xuất 400 w 1 đầu cấp nguồn 8 pin giá bán tại việt nam 8,1 triệu đồng phiên bản mình đánh giá trong bài viết này là gigabyte gtx 1060 g1 gaming. kể từ năm ngoái khi giới thiệu series xtreme gaming, g1 gaming tuy không còn là dòng cao cấp nhất của hãng linh kiện đài loan tuy nhiên nó vẫn thuộc phân khúc cao cấp. do dó bạn có thể thấy rằng giá của sản phẩm này là ở mức 8,1 triệu, cao hơn một chút so với mặt bằng chung 8 triệu . thiết kế đơn giản, nối tiếp phong cách g1 khi nói về thiết kế, series g1 của gigabyte được biết đến với sự đơn giản nhưng lịch lãm trong thiết kế. và phiên bản lần này cũng không phải là ngoại lệ với mặt nạ sử dụng tông màu đen làm chủ đạo với các chi tiết in chìm nổi khá sang chảnh nhưng phải nhìn kỹ mới thấy . ngoài ra cũng giống như phiên bản g1 gaming của 1080 1070, hãng thiết kế 4 chi tiết màu cam nổi bật, khá giống hình tia chớp. ở những dòng cao cấp xài tản windforce 3x, 4 tia chớp này xếp thành hình chữ x, khá giống biển tượng của xtreme series. còn ở windforce 2 x, vị trí của nó làm chúng ta có cảm tưởng như 2 cánh quạt đang xé gió vậy. là dòng card tầm trung, do đó gigabyte chỉ trang bị cho gtx 1060 g1 gaming hệ thống tản nhiệt windforce 2x với 2 cánh quạt. có lẽ do đã quá quen với kiển thiết kế windforce 3x ở các dòng cao cấp, cá nhân mình thấy nó hơi bị mất cân đối một tí. tuy nhiên cũng cần phải nhắc lại rằng đây là dòng card tầm trung, bởi vậy cũng không đòi hỏi hệ thống tản nhiệt khủng như những phiên bản cao cấp. tản khủng thì dĩ nhiên ai cũng khoái, nhưng nếu bớt hoành mà hiệu năng vẫn đủ dùng mà giá mềm xuống thì cũng không ảnh hưởng đến hoà bình thiên hạ. có chăng là giúp bạn dễ thở hơn khi sắm mà thôi. cánh quạt thiết kế theo dạng đặc trưng của windforce, lá quạt uốn cong với các vân giúp tăng lượng gió và giảm độ ồn. nhìn từ bên hông, chúng ta có thể nhận thấy là tuy vẫn chiếm 2 slot nhưng khối tản nhiệt của gigabyte gtx 1060 g1 gaming mỏng hơn kha khá so với phiên bản gtx 1070 1080. nó cũng chỉ sử dụng 2 ống đồng dẫn nhiệt, thay vì 3 so với bản windforce 3x. dĩ nhiên, hiệu năng tổng thể sẽ không tốt bằng nhưng về cơ bản chúng ta cũng không cần. trong quá trình hoạt động, hệ thống tản nhiệt của gtx 1060 g1 hoạt động rất tốt. chi tiết thì bạn có thể xem ở phần đánh giá hiệu năng bên dưới. gtx 1060 g1 gaming cũng được trang bị ốp lưng. nếu mình nhớ không nhầm thì năm ngoái trừ dòng xtreme, không có dòng card tầm trung nào của gigabyte có ốp lưng cả. năm nay thì ngay cả g1 cũng có, nói chung là giúp cho card trở nên ngầu hơn, bảo vệ được các linh kiện phía sau bo mạch. ngoài ra thì ốp cũng sẽ cho phép giữa card thẳng, tránh bị cong bo mạch cho tản quá nặng. tuy nhiên mình thấy rằng khối tản nhiệt của dòng này cũng tương đối nhẹ, nên cũng không quan trọng lắm. xu hướng đèn rgb tiếp tục tái xuất ở dòng card tầm trung với logo gigabyte và đèn fan stop. cả 2 đều là đèn led rgb, tức là bạn có thể thoải mái dùng phần mềm xtreme của gigabyte để điều chỉnh màu sắc cũng như cách phát sáng theo ý mình. dòng card này khi nhiệt độ không quá 50 thì quạt sẽ không quay để giảm độ ồn và tăng tuổi thọ của quạt. khi đó thì đèn fan stop sẽ sáng để báo hiệu cho bạn biết. ở phiên bản custom này, gigabyte trang bị cho dòng card của mình 1 cổng cấp nguồn 8 pin thay vì 6 pin như phiên bản tiêu chuẩn. như vậy trên lý thuyết chiếc card này có thể rút đến 225w điện năng so với 150w của bản founders edition, giúp nó có khả năng ép xung tốt hơn. riêng chiếc mà mình thử nghiệm trong bài viết này, xung nhịp của nó có thể lên gần 2000 mhz hơn 300 mhz so với mặc định mà chỉ sử dụng khoảng 70 định mức điện năng bạn vẫn có thể tăng lên nếu muốn . một điểm cần lưu ý là năm gtx 1060 năm nay không hỗ trợ chạy sli nhiều card, vì vậy bạn sẽ thấy sự vắng mặt của chân cắm sli. sự thật là hiệu năng của dòng card gtx 1060 năm nay đã được đẩy lên rất nhiều, vì vậy mình cũng không ngạc nhiên lắm về quyết định này của nvidia. cũng như mọi khi, gigabyte gtx 1060 g1 gaming vẫn sử dụng kết nối pci express 3.0 16x. mặc định thì khe này sẽ cung cấp tối đa 75w điện năng cho card, phần còn lại thì sẽ do cổng cấp nguồn phụ 8 pin tối đa 150w đảm nhiệm. gigabyte gtx 1060 g1 gaming được trang bị 3 cổng displayport 1.4, 1 hdmi 2.0 và 1 dvi d. đây là thiết lập tiêu chuẩn của geforce 10 series, đủ đáp ứng tốt nhu cầu của tất cả các game thủ hiện nay. hiệu năng đáng nể trong phân khúc tầm trung cấu hình thử nghiệm để đánh giá hiệu năng của gigabyte gtx 1060 g1 gaming, mình sử dụng 2 bộ máy với cấu hình như sau bộ 1 cpu core i5 3570k ivy bridge ép xung lên 4,2 ghz , main asus z77 v, 8 gb corsair vengence ddr3 1600, 120 gb intel ssd 520, psu fsp hyper 500w. bộ 2 cpu core i7 6900k broadwell e xung mặc định 3,2 ghz , main msi x99 gaming carbon pro, 8 gb geil ddr4 2400, 120 gb intel ssd 520, psu raider 650 w. bộ 1 là để cấu hình cân đối trong phân khúc tầm trung, sẽ là phân khúc mà các bạn game thủ thường lựa chọn gtx 1060 nhất. trong khi đó thì bộ 2 là bộ chơi tới nóc, hiệu năng chỉ giới hạn bởi chính sức mạnh của card. kết quả thử nghiệm thì bộ 2 luôn cao hơn bộ 1 trên dưới 5 fps, tức là cũng không quá nhiều so với số tiền mà bạn phải đầu tư thêm, chênh lệch ít nhất là 30 triệu . nói một cách đơn giản, hệ thống ivy mà mình thử nghiệm là tương đồng với sức mạnh của gtx 1060 trong trường hợp này là gigabyte gtx 1060 g1 gaming . như vậy bạn nào sử dụng core i5 skylake cũng không cần quá lo lắng về chuyện thắt cổ chai khi dùng chung với gtx 1060. bên dưới mình sẽ sử dụng kết quả của bộ 1 cho nó gần với hiệu năng thực tế mà bạn sẽ thấy được. một số lưu ý về gigabyte gtx 1060 khi bạn cài ứng dụng xtreme engine của gigabyte, chế độ oc mặc định có vẻ như tự động ép xung vượt định mức công bố của hãng. cụ thể hơn là dù gigabyte công bố xung nhịp boost của card là 1810 mhz ở chế độ oc , thực tế khi chơi game xung nhịp của card đo bằng xtreme engine lẫn after burner có thể lên đến gần 2000 mhz. hiện tượng này không chỉ riêng của gigabyte mà mình test card msi cũng thấy tương tự, kể cả các dòng cao cấp gtx 1070 1080. nói chung là mặc dù xung nhịp công bố là 1810 mhz, tuy nhiên xung nhịp thực tế khi chạy thì cao hơn kha khá. trong phần test bên dưới mình có chụp lại srceenshot, bạn có thể tham khảo xung nhịp thực ở góc trái phía trên đo bằng afterburner . tất cả đều đặt ở thiết lập hiệu ứng cao nhất nôm na là max setting ở độ phân giải fullhd và tắt chế độ khử răng cưa hoặc bật fxaa nếu có, cái này không làm giảm hiệu năng nhiều . 3dmark time spy phép thử time spy của 3d mark được thiết kế để đánh gía khả năng đồ hoạ của card khi chơi các trò được dựng trên nền tảng directx 12 mới nhất. trong phép thử này thì gigabyte gtx 1060 đạt 4157 điểm đồ hoạ. cũng cần lưu ý là do mình sử dụng cpu core i5 tầm trung nên điểm tổng thể không cao chỉ 3904 điểm, bộ 2 sử dụng nền tảng broadwell e điểm lên đến 4578 nhờ cpu mạnh hơn rất nhiều. fallout 4 fallout 4 vẫn là một trong những tựa game nhập vai khủng nhất hiện nay. ở độ phân giải fullhd, max hết tất cả hiệu ứng thì tốc độ khung hình của gigabyte gtx 1060 dao động từ 70 80 fps, quá đủ để bạn chơi mượt mà. cũng cần lưu ý là trò này mặc định luôn v sync ở 60 fps để đảm bảo trải nghiệm được tốt nhất. để thử nghiệm thì mình chỉnh lại file hệ thống để xem hiệu năng nó lên được bao nhiêu thôi, chứ chơi ở tốc độ khung hình cao thì game rất dễ bị lỗi vật lý. rise of the tomb raider sử dụng benchmark được tích hợp, rise of the tomb raider có điểm số trung bình là 82,2 vượt hơn kha khá so với chuẩn 60 fps. đây là kết quả sử dụng directx 12 của bạn cập nhật mới nhất, hiệu ứng đồ hoạ very high và khử răng cưa fxaa. do dựng hình bằng vulkan, afterburner không lấy được thông số của trò chơi này. overwatch gigabyte gtx 1060 g1 gaming luôn giữ được tốc độ khung hình trên 100 fps khi chơi overwatch, dù đánh nhau có dữ dội đến thế nào đi chăng nữa. tuy vậy khi lên 4k thì nó chỉ dao động trong khoảng 40 50 fps. nếu bạn muốn chơi mượt ở 4k thì cần giảm hiệu ứng xuống. doom 2016 doom cho bạn 2 tuỳ chọn là dựng hình bằng directx và vulkan. đối với những card mới như nvidia geforce 10 series gtx 1080 1070 1060 và amd radeon rx series rx 480 470 thì sử dụng vulkan sẽ đem tốc độ khung hình cao nhất tăng gần 20 fps đối với hệ thống thử nghiệm của mình . tốc độ khung hình luôn dao động trên 100 fps, nói chung là cực kỳ mượt mà. cũng giống như rise of the tomb raider, khi chuyển qua dựng hình bằng vulkan thì bạn cũng sẽ không lấy được thông tin của card bằng afterburner nhưng doom có chế độ hiển thị thông tin tích hợp sẵn cũng rất chi tiết. bạn có thể thấy gpu 100 nhưng cpu chỉ khoảng 85 , tức là không bị thắt cổ chai. nhiệt độ hoạt động, độ ồn và khả năng ép xung đây là thông số mình lấy trong lúc chơi game fallout 4, thứ tự lần lượt của mục gpu là định mức điện tăng tiêu thụ 71 , nhiệt độ 58 độ , tải 100 , full load , tốc độ quạt 36 và xung nhịp 1974 mhz . hệ thống được test trong môi trường phòng máy lạnh đặt ở 20 độ. nhìn chung đây là kết quả rất tốt, độ ồn trong lúc hoạt động cũng không đáng kể. với mức xung nhịp 1974 mhz, chúng ta có thể thấy là card vẫn chưa sử dụng hết hạn mức điện năng mà gigabyte đặt ra còn gần 30 và nhiệt độ cũng rất mát 58 độ . về cơ bản bạn hoàn toàn có thể đẩy lên cao hơn nữa. dĩ nhiên, một yếu tố rất quan trọng quyết định khả năng ép xung là bản thân của gpu. bên gigabyte họ chỉ đảm bảo là xung nhịp tối thiểu là 1810 mhz, đẩy được cao hơn thì sẽ phụ thuộc vào từng con chip. kết luận vậy ai là đối tượng của gigabyte gtx 1060 g1 gaming? câu trả lời là các bạn muốn chơi các trò mới ở độ phân giải fullhd với mức thiết lập hiệu ứng cao nhất, cùng mức chi phí đầu tư hợp lý. 8,1 triệu dành cho gigabyte gtx 1060 g1 gaming là một số tiền không nhỏ, tuy nhiên nó dễ chịu hơn nhiều so với gtx 1070 khoảng 12 triệu và gtx 1080 khoảng 18 triệu . cũng cần nhắc lại rằng do gtx 1060 không hỗ trợ sli, vì vậy nếu muốn nâng cấp về sau thì bạn chỉ có cách là thay bằng card mới, chứ không thể sắm thêm 1 cái nữa chạy sli. mình thấy ở việt nam thì ít ai chơi sli card tầm trung, cho nên có lẽ nó cũng không ảnh hưởng quá nhiều đến độ hấp dẫn của gtx 1060. tóm lại, về tổng thể thì gigabyte gtx 1060 g1 gaming và tất cả các phiên bản gtx 1060 đang bán trên thị trường là dòng card với tỉ lệ hiệu năng giá cả rất cao. hiệu năng của nó đủ để bạn max setting ở fullhd gần như tất cả các trò chơi mới hiện nay mà vẫn giữ tốc độ khung hình tối thiểu trên 60 ngoại lệ đó là game the witcher 3 wild hunt chỉ đạt khoảng 40 50 fps, cũng không đến nỗi tệ . ở thế hệ trước, phải đến gtx 970 giá vào khoảng 10 triệu thì chúng ta mới đạt được cấp độ này. còn giờ đây với chỉ 8 triệu, chúng ta đã có gtx 1060 hiệu năng tương đương với gtx 980 thế hệ trước khoảng 12 15 triệu theo công bố của hãng. gtx 1060 hay những dòng cao hơn? gtx 1060 tạm thời có thể xem là dòng card thuộc geforce 10 series có tỉ lệ p p tốt nhất hiện nay, tuy nhiên nó không hoàn hảo. sức mạnh của nó chỉ vừa đủ để bạn có thể trải nghiệm các trò chơi ở thiết lập hiệu ứng cao nhất với độ phân giải fullhd 1920x1080 , lên qhd 2560x1440 và 4k 3840x2160 thì nó chưa thể đáp ứng được mức khung hình tối thiểu 60 fps trừ khi bạn hạ hiệu ứng . đó là lý do mà gtx 1070 và gtx 1080 vẫn đáng cân nhắc. ngay cả khi chơi ở fullhd, sức mạnh của gtx 1070 và gtx 1080 cũng sẽ cho phép bạn đỡ phải nâng cấp phần cứng so với gtx 1060 trong tương lai gần. nói chung gtx 1060 có thể xem là sự lựa chọn kinh tế nhất vào thời điểm hiện nay, nhưng nó không hẳn là sự lựa chọn tốt nhất. mình sẽ có bài so sánh gtx 1060 với rx 480, gtx 1060 và gtx 1070 mời các bạn đón đọc.",13164,2885
3964,0,"đang tính mua 1 em mà phân vân không biết chọn em của hãng nào và mua cửa hàng nào ? mấy em zotac và msi có bản giá mềm hơn gần 2tr, tính build 1 bộ máy tính mà đắn đo hoài",172,43
3965,0,8.1tr thì vẫn còn khá cao đấy,29,7
3966,0,ngoài lề hỏi các bác chút cty e mới sắm bộ máy cho kỹ thuật.dell vostro có vga gt 705 mà e ít nghe quá bác nào biết dòng dell nâng cấp được không vì nó không có nguồn phụ mà case e thấy nhỏ thanks,217,46
3967,0,giá đắt thế. gần bằng cái laptop luôn rồi,41,9
3968,0,có hỗ trợ tương thích lùi pci express 2.0 không nhỉ? mà 8.1 củ chát qua!,72,16
3969,0,"gigabyte lúc nào giá cũng cao hoăn các hãng khac như msi, zotac ít tiền mua zotac bh 5 năm họp lý hơn.",104,24
3970,0,"mới ngày nào dành dụm tích cóp cắn răng nhịn ăn sắm e gtx 970 tiger giá còn cao hơn e này mà giờ đã thành đồ cổ, nhìn e này xong nhìn lại e 970 đang nằm cong trong thùng máy vì không có backplate mà rưng rưng",207,49
3971,0,"mình không rành về máy tính và card đồ họa, vậy cho hỏi mình làm việc nhiều với lightroom cc pts cc thì nếu gắn card này vào nó có giúp máy chạy mượt hơn không hay nó chỉ hỗ trợ chơi game thôi ?",196,46
3972,0,đợi tiếp 1050 sẽ trả lời sao với rx 470,39,10
3973,0,"8tr1 bằng mie 1 con console với thêm 1 tay cầm rồi,mà không biết xài được 2 năm có lỗi thời không .",90,23
3974,0,bằng cái iphone thôi chứ mấy p s 6 cũ,39,10
3975,0,đang an lành với con gtx 760m. chưa cần hú hí lên dòng 1xxx sớm,65,16
3976,0,"chỉ 8.1 tr thôi mà em nó ngang ngửa gtx 980 người ta nói thế, thực hư thế nào không rõ các bác quay trở về thời điếm vài năm trc khi mà 980 mới ra xem em nó bao nhiêu, thế mà khối người mua đấy thôi . cái gì cũng chê đắt được",223,56
3977,0,case nhỏ thì không nâng được đâu. nếu cắm gtx 750 chạy được nhưng phải tháo vỏ. đó là chưa kể đến nguồn đồng bộ dell toàn 180w quá ít,129,30
3978,0,"hồi truoc chơi game đúng là ngắm tới max setting, bây h chỉ cần chơi không lag , hình ảnh tầm tầm là đủ rồi, nên ngắm rx 460 là đủ",127,31
3979,0,"có 1280 cuda thôi, 1920 là gtx 1070 rồi",39,9
3980,0,"có đó bác. e nhớ không nhầm thì các phần mềm đồ hoạ thông dụng như pts, lightroom đều được tối ưu cho card nvidia. nên nếu lắp card mới thì hiệu năng khi xử lí đồ hoạ tất nhiên sẽ tăng rồi.",183,43
3981,0,em đang dùng đúng cặp này nhưng p8z77 v chứ 87 chắc bác ấy bật không lên kêu cháy card rồi cười,91,22
3982,0,"chán nhỉ.bộ máy hơn 2 chục củ mà lệch quá.i7 7400,ram 8g, mà vua cùi",79,15
3983,0,load chắc là load ảnh do lưu trên flick hay icloud thôi chứ mày thấy cái khác load bình thường mà,95,21
3984,0,"cho e hỏi là hiện máy e chip i3 3,5ghz, đang dùng cái gtx750ti thì cắm mấy bé như rx460,470 hay như con 1060 này có ok không ah? có bị thắt cổ chai không?",148,35
3985,0,"bài viết thiếu vài yếu tổ tưởng chừng như nhỏ nhưng lại thể hiện sự thiếu chuyên nghiệp rất lớn , đúng là voz vẫn hơn ở khoảng này 1. không mở tản nhiệt để show linh kiện bên trong , đặc biệt là đối với con này cái giá cao hơn vì giá trị của nó là chổ đó , 1 con 8tr1 với 1 con 6tr7 hơn ở chổ linh kiện chất hơn hẳn . 2 . không so sánh hiệu năng thực tế so với bản ref hoặc những con card khác để người tiêu dùng có cái nhình chung cho hiệu năng nhận được trên số tiền họ bỏ ra có phù hợp không .",497,120
3986,0,"rx460 hay rx470 thì còn được, chứ gtx 1060 thì sẽ hơi nghẽn đó bạn!",67,15
